Darija (Arabic),Darija (Arabizi),Arabic Standard,English
باغي ندير حجز فالساعة الثالثة ونص مور الظهر.,Baghi ndir 7ajz f sa3a tlt w nos mor 3a9l dohr.,,I want to make a reservation at 3:30 PM.
صندوق الأمان، عافاك.,"Sondoq l-aman, 3afak.",,"The safety box, please."
يعافاك ختار النبيذ المناسب.,ya3afak khtar nbiid lmonasb.,,Please choose the appropriate wine.
باغي شي بلاصة صغيرة.,Baghi chi blasa sghira.,,I want a small place.
واش خاصني نخلص ثمن الوقود؟,wash khassni nkhalles thaman l-w9oud?,,Do I need to pay for the fuel?
شفار. شدوه.,chfar. chdoh.,,Thief. They caught him.
حنا كنتسناو أصحابنا يجيو.,7na kantsnaw s7abna yjio.,,We are waiting for our friends to come.
عافاك عطيني شي صرف.,3afak 3tini chi srf.,,Please give me some change.
برمانوت ضيق، عافاك.,"brmanot 9diq, 3afak.",,"A tighter bermuda, please."
راها صغيرة و ظريفة.,raha sghira w 9rifa.,,She is small and cute.
شنو هيا الأوبرا ديال ليوم؟,Chno hiya l'opera dial lyoum?,,What is today's opera?
المقلية، عافاك.,"lmqliya, 3afak.",,"Fried, please."
مازال مارجعش ليا الغسيل ديالي حتى لدابا.,mazal marja3sh lia lghsil diali 7tta ldaba.,,I still haven't gotten my laundry back yet.
بالمناسبة، واش مسالي السبت الجاي؟,"b lmnasba, wash msali sbt ljay?",,"By the way, are you free next Saturday?"
واخا، من بعد، ربما غادي نتعارفو مزيان بجوجنا.,"Wakha, mn b3d, rbma ghadi nta3arfo mzyan bjoujna.",,"Okay, later, maybe we will get to know each other well."
تعامللت معاي بحال الى كنت ساعي.,t3amllt m3aya b7al ila knt sa3i.,,You treated me as if I were a servant.
كنشوف. أيضا، واش ممكن تساعدني مع واحد المشكل أخور؟,"knshof. ayDan, wach momkin tsa3dni m3a wa7d lmochkil akhor?",,"I see. Also, can you help me with another problem?"
يمكنك تديرلي العدسات الطبية فهاد النظارات؟,Yemkenk tdirli l3adsat ttebbiya fhad nnadarat?,,Can you put prescription lenses in these glasses?
غادي تاخذ جوج من هادي.,Ghadi takhd 2 mn hadi.,,You will take two of these.
كلب ظريف. شمن نسل؟,kelb 9rif. shmen nesl?,,A cute dog. What breed?
طاحتلي الشوكة. عافاك جيبلي وحدة آخرى.,Ta7atli lchouka. 3afak jib li wa7da okhra.,,I dropped the fork. Please bring me another one.
كان هادشي ممتع.,kan hadchi momti3.,,That was enjoyable.
بالتأكيد. سير مباشرةودور على ليمين في الزاوية الثالثة. غادي تلقاه على ليمين.,baltakiid. sir mباشra w dour 3la limin f zaouya talt3a. ghadi tl9ah 3la limin.,,Certainly. Go straight and turn right at the third corner. You'll find it on the right.
واشعندك أفلام بشرائح ملونة؟,wash 3ndk aflam bshray7 mlwona?,,Do you have films with colored slides?
واش كتعرف كاثي؟ هادي الحفلة ديال عيد ميلادها.,Wash kat3rf Kathy? Hadi l7afla dial 3id miladha.,,Do you know Cathy? This is her birthday party.
واش عند مخطط لوان؟,wash 3ndk mkhattat lwan?,,Do you have a color scheme?
واش يمكن لي نخلص بشيك سياحي؟,wash ymkn li nkhlls bchik syya7i?,,Can I pay with a traveler's check?
ولكن، هو، رجل، كيفاش نعرف بلي هادا هو الحاجة الحقيقية؟,"Wlkn, howa, rajel, kifash n3rf bli hada howa l7aja l7qiqiya?",,"But, he, a man, how do I know that this is the real thing?"
واش يمكن لي ناخدها معفية من الضرائب؟,wash ymkn li nakhdha m3fiya mn lDara2ib?,,Can I take it tax-free?
مقدرتش نحط اللأمتعة ديالي تحت المقعد. ممكن تخليه عندك، عافاك؟,"Ma9dertch n7eTT l2amti3a dyali te7t lme9ed. Momken tkhliha 3endek, 3afak?",,"I couldn't place my luggage under the seat. Can you keep it with you, please?"
ممكن عافاك تحط هاد الحقيبة فالكوفر؟,momkin 3afak t7e6 had l7qiba f lkofer?,,Can you please put this bag in the trunk?
أنا غادي على برا، اذن دابا نهزها.,"Ana ghadi 3la bara, idan daba nhzha.",,"I'm going outside, so I'll take it now."
عافاك صيفط شي حد مور الحقائبديالي فالستة وثلاثين.,3afak sifṭ shi 7d mor l7wayjb dyali f 36.,,Please send someone to pick up my bags at thirty-six.
بغيت خريطة سان فرانسيسكو والمنطقة اللي دايرة بيها.,bghit kharita San Francisco w lmanTi9a lli dayra biha.,,I want a map of San Francisco and the surrounding area.
اينا نوع ديال الخبز عندك؟,Ina no3 dial lkhobz 3ndk?,,What kind of bread do you have?
فين هو المصعد؟,Fin howa lme93ad?,,Where is the elevator?
واش كاين شي حد كيعرف يعزف على البيانو؟,wash kayn shi 7ad kay3rf y3zef 3la l-pyano?,,Is there anyone who knows how to play the piano?
فينا محطة خاصني ننزل باش نمشي لامباير ستيت بيلدينج؟,Fina ma7a6a kha9ni nenzel bash nemshi l'Empire State Building?,,Which station should I get off at to go to the Empire State Building?
الميزانية أقل من ألف دولار.,l-mizaniya a9al mn alf dolar.,,The budget is less than a thousand dollars.
شكرا ليك، ولكن مكنعتقدش بلي عندي الوقت باش نبقى لمدة جوج ليالي. واش ممكن نحجز غرفة مزدوجة في هذا الفندق بالنسبة ليا ليلة اثناعشر مارس فقط؟,"Chokran lik, walakin makant3ta9dch blli 3ndi lwa9t bach nb9a lmdda jouj llayali. Wach momkin n7jz ghorfa mozdoja f had lfondoq bnsba liya lilat 12 Mars fa9at?",,"Thank you, but I don't think I have the time to stay for two nights. Is it possible to book a double room at this hotel for me for the night of March 12 only?"
واش ممكن حجز غرفة مزدوجة كتطل على المحيط؟,wash momkin 7جز 3rfa mzdwja kat6l 3la lmo7i6?,,Is it possible to book a double room overlooking the ocean?
مزال مقررناش.,Mazal ma9arrarnach.,,We haven't decided yet.
رفيقي تعثر وتلوا ليه الكاحل ديالو.,Rfi9i t3attar w tlwa lih lka7l dialo.,,My friend tripped and twisted his ankle.
غادي نجرب شوية ديال شيربيت.,Ghadi njarrab chwiya dial shirbit.,,I’m going to try some sherbet.
واش كاين شي مطعم تايلاندي قريب؟,Wash kayn shi mat3am Taylandi qrib?,,Is there a Thai restaurant nearby?
راه كاين فنواحي ديال هاداك المبنى الطويل. اذن، رجع من نفس الطريق الي جيتي منها حتى لإشارات المرور. ثم، اتجه لليسار.,"ra7 kayn f nwa7i dial hadak lmbna ltwil. idan, rj3 mn nafs tri9 lli jiti mnha 7tta l isharaat lmoror. thmma, itjih llyasar.",,"It's located near that tall building. So, go back the same way you came until the traffic lights. Then, turn left."
خاصني نشد طيارة للوس انجليس غدا فصباح بكري.,Khasni nched tayara l Los Angeles ghda f sbah bkri.,,I need to catch a plane to Los Angeles early tomorrow morning.
"""من بعد غادي نقدر نوصي بثقة هادا """"جولة مدينة سان فرانسيسكو"""". هادا كيعلمك شكل سان فرانسيسكو.""","mn b3d ghadi nqdr nwsi bti9a hada ""jwala mdint San Francisco"". hada kay3llmk chkla San Francisco.",,"""Later, I might confidently recommend this 'San Francisco City Tour.' It teaches you about the shape of San Francisco."""
باغي ناخد التأمين.,Baghi nakhd t-ta2min.,,I want to get insurance.
أنطلبو شي كيس تبريد باش تخفف الألم.,Anṭlbo chi kis tbride bash tkhfef l'alam.,,We ask for an ice pack to ease the pain.
باغيا تشري فستان.,Baghya tchri fstan.,,She wants to buy a dress.
بشحال طاكسي للفندق؟,bch7al taxi lfondoq?,,How much is the taxi to the hotel?
فين كاين المرحاض؟,Fin kayn lmer7aḍ?,,Where is the bathroom?
واش كيكلف شي حاجة الدخول لهاد المبنى؟,wash kikllf shi 7aja ddkhoul lhad lmbna?,,Does it cost anything to enter this building?
ديرها بطريقتك.,dirha btri9tek.,,Do it your way.
كنبحث علي شي حاجة مثيرة.,Knb7ath 3la chi 7aja mthira.,,I'm looking for something exciting.
السرجم واحل.,s-serjm wa7el.,,The window is open.
فينا جانب من يونيون سكوير هو؟,fina janib mn Union Square howa?,,Where is the side of Union Square?
نص أوقية من شانيل رقم خمسة، عافاك.,"nss ou9iya mn Chanel ra9m 5, 3afak.",,"A small bottle of Chanel No. 5, please."
شي قهيوة؟,chi qahwa?,,Some coffee?
واش غنحتاج لتذكرة؟,wash ghant7taj ltadkira?,,Will I need a ticket?
بالنسبة لثمن رسوم الخدمة؟,bnsba lthmn rsum lkhidma?,,What about the service fee?
شحال ديال الوقت من هنا؟,Ch7al dyal lwa9t mn hna?,,What time is it from here?
كريم وسكر؟,Karim w sukaR?,,Sugar and cream?
واش عندك شي معدل تخفيض للأعضاء؟,wash 3ndk shi m3dl tkhfi9 ll2a3da2?,,Do you have any discount rates for members?
واش كاين سوبر اكسبريس فالتاسعة نص؟,wash kayn super express f 9:30?,,Is there a super express at half past nine?
سمحو لي نتحقق من سائل الفرامل والمحرك. محركك كيبان تقريبا واقف.,Sma7u li ntta7qq mn sa2il lframil w lmo7rik. Mo7rikk kayban tqriban waqf.,,Let me check the brake fluid and the engine. Your engine seems almost stalled.
مكانش الغلط ديالي.,Makanch lghalat dyali.,,It wasn't my fault.
مكاينش الكهرباء.,Mkanch lkahrba2.,,There is no electricity.
غادي نبلغ الشرطة بهادشي.,Ghadi nblagh lpolice bhadchi.,,I will report this to the police.
واش غادي يخلص كل واحد على المشروب ديالو؟,wash ghadi ykhlass kol wa7ed 3la l-mshroub dialo?,,Is everyone going to pay for their own drink?
كاين شي بلاصة بين ثلاثين لخمسين دولار لليلة.,Kayn shi blasa bin 30 l 50 dollar l lilat.,,Is there a place between thirty to fifty dollars per night?
عافاك صلح هادشي.,3afak sla7 hadchi.,,Please fix this.
فأيام رأس العام . وفالمناسبات الخاصة بحال حفلات الأعراس، احتفالات الولائم أو الجنازات.,"F'ayyam ra's l3am. W f'lmonasabat lkhasa b7al 7aflat l3ras, i7tifalat lwla'im aw ljnazat.",,"During New Year's days, and on special occasions like wedding parties, banquets, or funerals."
خردل زايد، عافاك.,"khrdl zayd, 3afak.",,"Extra mustard, please."
علاش ماتعطيهاش هدية؟,3lash ma t3tihash hadiya?,,Why don't you give her a gift?
شنو الفيلم اللي تنصح بيه؟,shno lfilm lli tans7 bih?,,Which movie do you recommend?
هنا عشرين وتعطيني جوج دولارات صرف، عافاك.,"hna 3echrin w t3atini jouj dolarat srf, 3afak.",,"Here is twenty, and give me two dollars in change, please."
ضربتني من الجنب.,DarbeTni mn ljnb.,,She hit me from the side.
ممكن نجي أكثر من جوج.,momkin nji aktar mn juj.,,Is it possible for me to bring more than two?
واش هادي الأمتعة من الرحلة ديال جيه ايه ال صفر واحد؟,wash hadi l-amti3a mn r7la dial JAL 01?,,Are these the luggage from flight GAL01?
هادي هي أول رحلة لي لباريس.,Hadi hiya awel re7la li lParis.,,This is my first trip to Paris.
واش ممكن تقدر التكلفة قبل ما تبدا الخدمة فيه؟,wash momken tqdr t-taklifa qbl ma tbda l-khdma fih?,,Can you estimate the cost before starting the service?
دخل، عافاك.,"dkhl, 3afak.",,"Come in, please."
رحلة ديالنا ديال المشي لمسافات طويلة خاص يكون فيها بزاف ديال المرح.,r7la dialna dial l-mshi l-masafat 6awila khass ykon fiha bzaf dial l-mra7.,,Our hiking trip should be full of fun.
فين ممكن نركب القارب؟,Fin momkin nerkeb l-9arib?,,Where can I take the boat?
ما عندنيش حقيبة ليتهز هاد المبلغ اذن نديروه فهاد الحقيبة البلاستيكية الكبيرة.,ma 3andish 7qiba li thzz had lmbla3 idan ndirouh f had l7qiba lblasticia lkbirra.,,"I don't have a bag to carry this amount, so let's put it in this big plastic bag."
باغي نلعب التنس.,Baghi nl3b tennis.,,I want to play tennis.
كاين الأناناس والبرتقال وعصير الطماطم.,kayen l-ananas w l-bortoqal w 3a9ir t-tmaṭem.,,"There is pineapple, orange, and tomato juice."
الجيهة ديال اليسارمن هاد الطابق، قريب من المصعد.,"ljiiha dial l-yasar mn had ttabq, qrib mn l-mu93ad.",,"The left side of this floor, near the elevator."
شكون اللي غيلعب في قاعة الحفلات الموسيقية اليوم؟,shkon lli ghayl3b f q3at l7aflat lmosi9iya lyoom?,,Who is going to perform in the concert hall today?
تبغي عوض ديكشي تتفرج ففيلم مختلف؟,tbghi 3w9d dikchi ttfrrj f film mkhtlf?,,Do you want to watch a different movie instead?
عافاك غير هاد شيك السياحي بالفلوس.,3afak ghir had chik syya7i b lflous.,,Please cash this traveler's check.
باغي نفس الدورة غدا، عافاك.,"Baghi nafs d-dawra ghda, 3afak.",,"I want the same session tomorrow, please."
ممكن نعطيك شي إجابة أحسن على هادشي من بعد شوية ديال العروض.,momkin n3tik shi ijaba a7san 3la hadchi mn b3d chwiyya dial l3roud.,,I can give you a better answer about this after a bit of consideration.
باغي شي هدية لذكرى سنوية.,Baghi chi hdia l dikra sanwiya.,,I want a gift for an anniversary.
شنو هي المسرحيات الموسيقية الموجودة دابا؟,shno hiya lmasra7iyat lmusiciya lmojooda daba?,,What musicals are currently available?
واش عندك مراية؟,wash 3ndk mraya?,,Do you have a mirror?
سمحلي، لكني تلفت على طريقي. واس ميمكن تساعدني؟,"Sme7li, lakin tlefet 3la 6ri9i. Wash momkin tsa3dni?",,"Sorry, but I'm lost. Can you help me?"
غادي ناخد هاد الواحد، عافاك.,"Ghadi nakhd hād lwā7d, 3afak.",,"I will take this one, please."
ميمكنش ليك تجيب الألعاب النارية لكندا.,Maymknsh lik tjib l'alaab nnariya l Kanada.,,You cannot bring fireworks to Canada.
الطبخ زوين ديال زوجتك.,lṭbkh zwin dyal zowjtk.,,Your wife's cooking is good.
محتاج لشي مساعدة؟,m7taj lshi msa3da?,,Do you need any help?
ممكن تحجز طاكسي مع الستة ديال صباح الغد، عافاك؟,"momkin t7jz taxi m3a s-setta dial sbah l-ghd, 3afak?",,"Can you book a taxi for 6 a.m. tomorrow, please?"
ماذا تبغي ىيكون مع الدخول ديالك؟,mada tabghi ykoun m3a ddkhoul dialk?,,What do you want to happen with your arrival?
واش كيان شي بوتيك هنا؟,wash kayn shi boutique hna?,,Is there a shop here?
غادي تعمر هاد البلاصة بالناس، واش بصح؟,"Ghadi t3ammar had lblasa bnnas, wash bssa7?",,Is this place really going to be filled with people?
سمحلي. غادي تكون واجدة فتقريبا خمسة دقايق.,Sma7li. Ghadi tkoun wajda f tqriban 5 d9aye9.,,Sorry. It will be ready in about five minutes.
جاني تشنج فعنقي ملي كنت ناعس.,Jani tchannej f 3enqi mlli knt na3s.,,I got a cramp in my neck while I was sleeping.
واخا مكاين حتا مشكل. ممكن نشوف البسبور ديالك؟,"Wakha, makayn 7tta mochkil. Momkin nchouf l-passport dyalk?",,"Alright, no problem. Can I see your passport?"
معنديش الفلوس.,ma3ndich lflous.,,I don't have money.
فوقاش خاصني نكون فالمحطة؟,fou9ach khassni nkoun felma7ta?,,When should I be at the station?
كاين بزاف ديال المطاعم فهاد النواحي.,Kayn bzaf dial lma6a3m fhad nwa7i.,,There are many restaurants in this area.
راه حدا غرفة الامانات.,raha 7da ghorfat l-amanat.,,It's next to the security deposit room.
فرحت بالكلام معاك.,fra7t b lklaam m3ak.,,I enjoyed talking to you.
كاين شي جولة بعد الظهر؟,kayen chi jwala b3d 3lDhor?,,Is there a tour in the afternoon?
أنا مع اصحابي.,Ana m3a s7abi.,,I am with my friends.
تمتعت بإقامتي. شكرا.,tmat3t b2qamti. shokran.,,I enjoyed my stay. Thank you.
الشاطئ كاين مباشرة لتحت. منظر زوين.,lchaṭi kaayn mbashra lta7t. manḍar zwin.,,The beach is directly below. Beautiful view.
شكرا ليكي على الانتظار، انسة ماكغوير. ها هوا. اتفضلي، عافاكي.,"Chokran liki 3la l'ntidar, anssa Makghwir. Ha howa. TfaDDli, 3afak.",,"Thank you for waiting, Miss McGuire. Here it is. Please, go ahead."
واش عندك صورة شخصية؟,wash 3ndk sora shakhsiya?,,Do you have a profile picture?
سبعة، عافاك.,"sba3a, 3afak.",,"Seven, please."
بغيت نصيفط هادشي للمصبنة. فوقاش يكون واجد؟,bghit nsift hadchi lmasbna. fou9ach ykoun wajd?,,I want to send this to the laundry. When will it be ready?
عندي سروال مخطط.,3ndi serwal mkha6a6.,,I have striped pants.
نعم. توصلوني شي أمتعة ديال شي حد أخر للغرفة ديالي دابا. تحقق من داكشي، عافاك؟,"Na3m. Twa9loni shi amti3a dial shi 7ad akhor l'ghorfa diali daba. T7a9a9 mn dakchi, 3afak?",,"Yes. Some belongings of someone else were delivered to my room just now. Can you check that, please?"
ممكن نشرح داكشي بالتفصيل؟,mokn nshr7 dakchi btafsil?,,Can we explain that in detail?
واش نعستي مزيان؟,wash n3sti mzyan?,,Did you sleep well?
ممكن تضغط على زر التصوير؟,momkin tdo9a3 3la zir ttswir?,,Can you press the capture button?
جوج مفاتح، عافاك.,"jooj mfate7, 3afak.",,"Two keys, please."
بغيت مصباح.,bghit msba7.,,I want a lamp.
راها فالتالي ديال الممر.,raha f t-tali dyal l-mmar.,,It's at the end of the hallway.
بغيت شي مذكرة.,bghit shi mdakra.,,I want a notebook.
واش غادي نمشيو فالطوبيس؟,wash ghadi nmshiw f ltoobis?,,Are we going by bus?
قلتي بلي غادي تمشي لطوكيو غدا؟,qlti blli ghadi tmshi ltokyo ghda?,,You said you're going to Tokyo tomorrow?
خليوني ننعس حتا للتاسع ديال الصباح.,khaliyouni n3ass 7ta ltta9s dyal s-sba7.,,Let me sleep until nine in the morning.
لا بد لي من نقل إلى أ و واحد صفر صفر. واش ممكن؟,la bdd li mn nql ila A w wa7d 0 0. wash momkin?,,I need to transfer to A100. Is it possible?
كيفاشدايرة اللعبة هاد الايام؟,kifash dayra l3bba had l2iyam?,,How's the game these days?
حاس براسي مضغوط من الصدر.,7ass brasi mdo3o6 mn l-sdr.,,I feel pressure in my chest.
مكاين حتا مشكلة. الى كنتي غاتجي فخمسة شتنبر، يمكن ليك تتمتع بفيلم علمي لأن عندنا يوم مفتوح خاص الجمعة الاولى من كل شهر.,"Makan 7ta mochkil. Ila konti ghatji f 5 septembre, ymkn lik ttmtta3 b film 3ilmi 7it 3ndna nhar maftou7 kha9 l jom3a l oula mn kol chahr.",,"No problem. If you're coming on September 5th, you can enjoy a science film because we have an open day on the first Friday of every month."
واش عندك شي جولة أخرى؟,wash 3ndk shi jwala okhra?,,Do you have another tour?
واخا، نقص فلمية واش مقبول؟,"Wa5a, nqes flmiya wash mqbol?",,"Okay, if I lower the price, is it acceptable?"
انا غادي لباريس.,ana ghadi lparis.,,I am going to Paris.
ماشي آخر طراز، ياك بصح؟,"mashi akher traz, yak bssa7?",,"""Not the latest model, right?"""
مقررة فثمنية وثلاثين فالليل بالتوقيت المحلي.,mqerra f 8 w 30 f l-lil b t-tou9it l-ma7alli.,,Scheduled at 8:30 PM local time.
خذ لينا صورة مع هادا، عافاك.,"Khud lina sowra m3a hada, 3afak.",,"Take a picture of us with this, please."
واخا. غيكون طبسيل متوسط ​​الحجم وكرة الروز.,Wakha. Ghiykon tbsiil motwaset l7ajm w kora d lroz.,,Okay. It will be a medium-sized plate and a ball of rice.
كيفاش كاتبان هادي؟,Kifash katban hadi?,,How does this look?
بغيت نشوف هادا الواحد اللي فالسرجم، عافاك.,"bghit nchouf hada lwa7ed lli fserjem, 3afak.",,"I want to see the one at the window, please."
ما يمكنش. حنا فعطلة. كنرفض الجلوس في غرفة ديال الفندق ونتفرج فالبيسبول فالتلفزيون. أريد أن أرى مسرحية.,ma yimkench. 7na f 3oTla. kanrfaD ljlous f ghorfa dial lfondoq w ntfarraj f lbaseball f telfezyon. bghit nchoof masra7iya.,,Impossible. We're on vacation. I refuse to sit in a hotel room watching baseball on TV. I want to see a play.
واش نقدر نلمسها؟,wash nqdr nlmsha?,,Can I touch it?
ممكن تجي لهنا باش تصلحو؟,momkin tji lhna bash tsal7o?,,Can you come here to fix it?
بغيت شي خيوط اصطناعية.,bghit shi khyout 9stina3iya.,,I want some synthetic threads.
سميتي تارو تاناكا. عندي حجز.,Smiti Taro Tanaka. 3ndi 7jez.,,My name is Taro Tanaka. I have a reservation.
بغيت شوية ديال كريم التطهير.,bghit chwiya dial krim ttohhir.,,I want some cleansing cream.
بغيت سترة بلكمام طوال.,bghit stara blkmam twal.,,I want a long-sleeved jacket.
تسرقلي من الحقيبة ديالي.,tsrqli mn l7qiiba dyali.,,You stole from my bag.
طريقنا كيبانلي عبرنا بزاف ديال المرات، ماشي هاكا؟,"Tariqna kaybanli 3brna bzaf dial lmarat, machi haka?",,"Our paths seem to have crossed many times, haven't they?"
ممكن نشو القائمة مرة اخرى؟,momkin nchoof l9a2ima mara okhra?,,Can I see the menu again?
كتبان شوية خضرا.,ktban chwiya khdra.,,There are some green hills.
شحال العدد؟,Ch7al l3adad?,,How much?
الفريز، عافاك.,"lfreez, 3afak.",,"Strawberries, please."
جبل فوجي هو أعلى قمة فاليابان في ثلاثة آلاف وسبعمائة وستة وسبعين متر.,jbel Fuji howa a3la qmma f l-Yapan fi tlata alf w sb3mya w stta w sb3in metr.,,"Mount Fuji is the highest peak in Japan at 3,776 meters."
لا مزال. كاين بزاف تختار من بينهم.,la mazal. kayn bzaf t5tar mn binhom.,,Not yet. There are many to choose from.
باغي شوية ديال كريم الليل.,Baghi chwiya dial krim d l-lil.,,I want some night cream.
راها بين المخبزات ومحل الجزار.,raha bin l-mkhbzat w ma7al jzzar.,,It's between the bakery and the butcher shop.
يمكن ليك تقصر الأكمام؟,ymkn lik t9sr l-akmam?,,Can you shorten the sleeves?
متأسف ماكينش ملعب للجولف هنا.,mta2sef makaynch mla3b llgolf hna.,,"Sorry, there is no golf course here."
ممكن توريني الحلقة الثانية من اليسار؟,momkin twerini l7el9a taniya mn lyesar?,,Can you show me the second ring from the left?
ممكن تطلب منو يتصل بيا؟,momkin t9olb meno yetsel biya?,,Can you ask him to call me?
حاولت ندير مكالمة دولية. لم تحصل واش دازت؟,7awlt ndir mokalma dowliya. Ma 7sselch wash dazat?,,I tried to make an international call. Did it go through?
هادا غلط.,haada ghalt.,,This is wrong.
نعم داك الشي اللي كاين. تقدر تشوف الراية قدام مكتب البريد.,na3m dak shi lli kayn. T9der tchouf r-raya qdam mektab l-breed.,,"Yes, that's how it is. You can see the flag in front of the post office."
ياك بالتأكيد غادي ترسلهوم، ياك بصح؟,"yak bta2kid ghadi tarselhom, yak b97?",,"You're definitely going to send them, right?"
باغي ندير شي مكالمة هاتفية بالبطاقة دلائتمان.,Baghi ndir shi mokalama hatifiya b lbitaka d l'iktiman.,,I want to make a phone call with a credit card.
بغيت ديالي تمشي.,bghit diali tmshi.,,I want mine to go.
ملي توصل غادي نخلصو باش يوصلك حتى للععنوان ديال الدار.,Erreur,,"When it arrives, we will pay to have it delivered to your home address."
فهاد الأيام أنا ديما كنخدام الكمبيوتر في العمل.,fhad l'ayyam ana dima kan5dam l'computer f l3amal.,,"These days, I’m always working on the computer at work."
واخا. فهمت. غادي نجي لبلاصتك.,waxa. fhemt. ghadi nji lblastk.,,Alright. I understand. I will come to your place.
لا، هادا ما يكفيش.,"La, hada ma ykafich.",,"No, this is not enough."
واش يمكن لي ناخد بطانية وخدية؟,Wash ymkn li nakhd bataniya w khddiya?,,Can I take a blanket and a pillow?
ممكن تجي لهنا فأقرب وقت، عافاك؟,"momkin tji lhna f2arreb wqt, 3afak?",,"Can you come here as soon as possible, please?"
كاس ديال القهوة عافاك.,kass dial l9ahwa 3afak.,,"A cup of coffee, please."
كبحث على بطاقات هاواي نموذجية.,kba7t 3la bi6a9at Hawaii numudhijia.,,Looking for typical Hawaii cards.
ممكن تزير الخصر بمقدار ثلاثة سنتيمترات؟,momkin tzir l-khser b-meqdar 3 santimat?,,Can you tighten the waist by three centimeters?
أنا نفس العمر.,Ana nafs l3omr.,,I am the same age.
