Darija (Arabic),Darija (Arabizi),Arabic Standard,English
هادا واح ليك اسيدي.,haada wa7 lik a sidi.,,"Here you go, sir."
ما عنديش أمتعة للتسجيل.,ma 3ndish amti3a lltasjil.,,I have no luggage to check in.
طبعا خذ وقتك.,Tba3an khod waktak.,,"Of course, take your time."
انا هنا فمهمة وسائل الإعلام.,ana hna f mohimma wsa2il l2i3lam.,,I am here on a media mission.
واش عندك أفلام الصيف؟,wash 3ndk aflam s-sif?,,Do you have summer movies?
فوقاش غادي يكون الطران الجاي لواشنطن؟,fou9ach ghadi ykoun ltran ljay lWashington?,,When will the next train to Washington be?
اللي طوال هوما اللي في الرواج حاليا.,lli twal huma lli f rrawaj 7aliya.,,The long ones are the ones in trend right now.
غادي نرجع اليابان الاسبوع الجاي.,Ghadi nerja3 l-Yapan l-sbou3 l-jay.,,I will return to Japan next week.
واش عندك خريطة مترو الانفاق؟,wash 3ndk khriTa metro l-anfa9?,,Do you have a subway map?
واش سفر طويل؟,wash safar toulil?,,Is the trip long?
ممكن تبدلي هادي بوحدة جديدة؟,Mumkin tbdli hadi b wa7da jdida?,,Can you replace this with a new one?
شخصان.,shkh9an.,,Two people.
جوج ديال الناس؟,jouj dial nnas?,,Two people?
انا ماشي على خير. ممكن نحنى المقعد ديالي؟,ana mashi 3la khir. momkin n7ni lme9ed dyali?,,I'm not feeling well. Can I recline my seat?
الحادي عشر واربعين فالصباح.,l7adi 3chra w 40 f Sb7.,,Eleven forty-one in the morning.
ممكن تقولي على شي مطعم معروف بين اللشباب؟,Mumkin t9olli 3la shi ma63am ma3ruf bin lshabab?,,Can you tell me about a popular restaurant among young people?
السيارة ديالو كانت كتخدم بأقصى سرعة.,s-sayara dialo kant katkhdem b'a9sa sser3a.,,His car was running at maximum speed.
ممكن نخلي رسالة؟ كنتاصل باش نأكد التهيين مع السيد إبيرت يوم الأربعاء الجاي في الساعة الحادية عشرة ديال صباح.,momkin nkhali risala? kntasel bash n2akid tthyin m3a ssi Ebert yawm l-arb3a ljay f sa3a l-7adiya 3chra dial sba7.,,Can I leave a message? I'm calling to confirm the appointment with Mr. Ebert next Wednesday at 11 a.m.
واش ممكن تفسر لي المرض ديال باللغة الإنجليزية؟,wash momkin tfasser liya lmarad diali b llogha lengliziya?,,Can you explain the illness to me in English?
ممكن تصيفط طاكسي للمدخل الرئيسي لمركز ويستمينستر التجاري؟,momkin tsift ta9si l lmadkhal rra2isi l markaz westminster tijari?,,Can you send a taxi to the main entrance of Westminster Mall?
شحال من مرة خاصني نبدل الطرانات باش نوصل لهنا؟,Ch7al mn mara khassni nbdl ltranat bash nwsal lhna?,,How many times do I need to change trains to get here?
واش هادشي صحيح؟ خليني نتحقق. أوه، أنا متاسف بزاف، السيدة تاكانو. هادا غلطنا. هاكي الفاتورة الجديدة. ممكن توقعي هنا، عافاكي؟,"Wash hadchi s7i7? Khallini nte7aqq. Oh, ana mtasef bzzaf, l-sayda Takano. Hada ghalatna. Haki l-fatura l-jdida. Momkin twa9i hna, 3afak?",,"Is this true? Let me check. Oh, I’m very sorry, Mrs. Takano. This is our mistake. Here’s the new invoice. Could you please sign here?"
رجعلي خمسة دولارات، عافاك.,"rj3li 5msa dolarat, 3afak.",,"Give me back five dollars, please."
السدادة ديال حوض الاستحمام مكتدش تماما.,السدادة dial 7o9 listi7mam makatdch tmanan.,,The bathtub stopper doesn't seal properly.
هادا غي مجرد تعبير على تقديري.,haada ghi mejrad ta3bir 3la tqadiri.,,This is just an expression of my appreciation.
ممكن تعمر هاد النموذج؟,momkin t3ammar had nnomo9aj?,,Can you fill out this form?
وشنو بالنسبة لهاد النماذج البلاستيكية؟,weshno bennesba lhad nnemadjej lblastikiyya?,,What about these plastic models?
شنو هي العلامات التجارية اللي عندك؟,shno hiya l3alamat tijariya lli 3ndk?,,What brands do you have?
الكعب مرتفع بزاف بالنسبة لي.,lk3b mrtf3 bzaf bnsba liya.,,The heel is too high for me.
أنا مسدود عليا فالغرفة ديالي.,Ana msdoud 3liya f lghorfa dyali.,,I am locked in my room.
شحال ديال الوقت كنتي فباريس؟,Ch7al dyal lwa9t konti fParis?,,How long were you in Paris?
ممكت تعطيني طوابع بريدية لثلاثة بطاقات بريدية لليابان؟,mmkn t3tini tawaab3 briidiyya ltlata btaqaat briidiyya llyaban?,,Can you give me postage stamps for three postcards to Japan?
كينطق ج-و-ر-و-ه.,kayntaq j-o-r-o-h.,,"He pronounces it ""j-o-r-o-h."""
تبغي تاخد شي مشروب؟,tbghi takhod shi machrob?,,Do you want to get a drink?
استلقي هنا.,stlqi hna.,,Lie down here.
ديرها برقية مستعجلة عافاك.,Dirha bar9iya msta3jla 3afak.,,"Make it an urgent telegram, please."
وفقا لتقرير الطقس، غادي يكون الثلج غدا.,"Wafqan li ta9rir lta9s, ghadi ykoun ltelj ghda.",,"According to the weather report, it will snow tomorrow."
بغيت الكرة.,bghit lkora.,,I want the ball.
من المؤكد. غنكونو فرحانين نديرو هادشي.,mn lmo2akd. ghanakono fr7anin ndiro hadchi.,,Certainly. We would be happy to do this.
مهلا، هادا كتاب كوميدي ماليزي. غادي نشري واحد غادي نديه للدار بحال قطعة محادثة.,"Mehla, hada kitab komidi malizi. Ghadi neshri wa7ed ghadi ndih lddar b7al 9eṭ3a mo7adatha.",,"Wait, this is a Malaysian comedy book. I’ll buy one and take it home like a conversation piece."
"""الطريق للنجاح هو """"جينمياكو""""، ياك بصح؟""","""الطريق للنجاح هو """"جينمياكو""""، ياك بصح؟""  
Transcription in Arabizi:  
""ltri9 lnnja7 howa 'jinmyako', yak b97?""",,"""The road to success is 'hard work,' right?"""
غادي نوصل للفندق فتقريبا التاسعة ديال الليل.,Ghadi nwasl lfondoq fta9riban 9 diyaal lil.,,I will arrive at the hotel at around 9 PM.
عندي تقريبا ألفي وخمسمائة دولار بالين الياباني.,3ndi tqreeban 2000 w 500 dollar b l-yen l-yabani.,,I have approximately two thousand five hundred dollars in Japanese yen.
نعم، درنا. غادي نوريك شوية.,"Na3m, drna. Ghadi nwrik chwiya.",,"Yes, we did. I’ll show you a bit."
بغيت شوية ديال الحبوب المنومة.,bghit chwiya dial l7bob lmnawma.,,I want some sleeping pills.
غادي نكون هنا حتى التاسع. كنتمنى تشد المجرم في أقرب وقت ممكن.,Erreur,,I will be here until the ninth. I hope you catch the criminal as soon as possible.
أنا متأكد بلي المجرم قريب.,Ana mt2kd blli lmojrm qrib.,,I am sure that the criminal is nearby.
عشرة طوابع عافاك.,3achra tawa3ib 3afak.,,"Ten stamps, please."
أنا عندي باحتقان في الحلق.,Ana 3ndi ba7ti9an f l7alq.,,I have a sore throat.
انا باغي شوية ديال الهدايا التذكارية من نيويورك.,ana baghi chwiya dial lhdaya tdkariya mn New York.,,I want some souvenirs from New York.
انا غادي نغادر. ممكن تصيفط شي حمال؟,Ana ghadi nghader. Momkin tsift shi 7mal?,,I am going to leave. Can you send a porter?
ساعتي توقفات.,sa3ti twaqfat.,,My watch stopped.
أوه واش هو؟ كيفاش بغيتيه؟,Oh wash howa? Kifash bghitihe?,,"Oh, what is it? How do you want it?"
غادي نكونو فاتحين فالساعة التاسعة صباحا.,Ghadi nkouno fat7in f sa3a tas3a sb7an.,,We will be open at 9:00 AM.
بغيت كتاب تلوين.,bghit ktab talwin.,,I want a coloring book.
كنظن عندي حريق الرأس.,Kandnn 3ndi 7ri9 rras.,,I think I have a headache.
واش خاصني نمشي لبنك ياباني؟,wash khassni nmshi lbank yabani?,,Do I need to go to a Japanese bank?
خاصك تصرف الفلوس فالبنك.,Khassek tsref lflous f lbank.,,You need to deposit the money in the bank.
واش كاين وقت بزاف قبل المغادرة؟,wash kayn wa9t bzaf qbl lmaghdra?,,Is there a lot of time before departure?
زوجك واحد من أفضل الزبناء ديالنا.,zowjk wa7ed mn afdal zbenna dyalna.,,Your husband is one of our best customers.
واش كتعرف طبيب أسنان مزيان؟,Wash kat3raf tbib snan mzyan?,,Do you know a good dentist?
اوه خاصك تخبر القنصلية دابا.,owa khasek tkhber lconsulya daba.,,"Oh, you need to inform the consulate now."
مهزوزة، ماشي مخفوقة.,"mahzouza, machi mkhoufo9a.",,"Shaken, not whipped."
واش تبغي طاولة فالمطعم الرئيسي أو فغرفة خاصة، ا سيدي؟,"Wash tebghi tawla felmat3am rra2isi aw fghorfa kha9sa, a sidi?",,"Do you prefer a table in the main restaurant or in a private room, sir?"
كاين بزاف ديال الناس كيمشيو للشاطئ خلال الموسم.,kayen bzaf dial nnas kaymshiw lchaṭiʾ khilal lmosim.,,There are many people who go to the beach during the season.
كنوزن تقريبا مائة وخمسين رطل.,Knouzan tqreeban 150 rtel.,,I weigh approximately one hundred and fifty pounds.
فين خاصني ننقل؟,Fin khassni n-nqel?,,Where should I move?
فين هو مكتب الممتلكات المفقودة؟,Fin howa maktab l-momtlikat l-maf9ouda?,,Where is the lost and found office?
واش كاين شي طوبيس كيمشي مباشرة لتما؟,wash kayn shi tobiss kaymshi mobashra ltma?,,Is there a bus that goes directly there?
واش محتاج لشي معاملة خاصة؟,wash me7taj lshi m3amla kha9a?,,Do you need any special treatment?
واش غايكون فلوس ولا بطاقة دفع؟,wash ghaykon flous wla bita9at dafa3?,,Will it be cash or a payment card?
انتقلنا لهاد الدار قبل عام.,ntqlna lhad dar qbl 3am.,,We moved to this house a year ago.
شحال ديال الوقت خاص باش ناخد الفيزا ديالي؟,Ch7al dyal lwa9t kha9s bach nakhd l-visa dyali?,,How long does it take to get my visa?
فين كاين الحمامات؟,Fin kayn l-7ammamat?,,Where are the baths?
المبلغ الإجمالي هو مائتان وثلاثة وأربعون جنيه، أسيدتي.,"lmeblgh l'ijmali howa mi2tan w tlata w arba3in jnih, asidti.",,"The total amount is two hundred and forty-three pounds, madam."
هادي هدية. ممكن تلفهالي فشوية ديال ورق التغليف الجميل؟,hadi hdiya. momkin tlefhaly fchwiya dial wr9 ttaghlif ljamil?,,This is a gift. Can you wrap it for me in some nice wrapping paper?
منظر زوين. هادي مسارات كبيرة.,mnDar zwin. hadi masarat kbira.,,A beautiful view. These are big trails.
كاين ناس مجروحين.,kayen nas mjrou7in.,,There are hurt people.
شمحلي فين هي المحطة فهاد النواحي؟,Ch7al li fina hiya l-ma7a6a f had nnwa7i?,,"Excuse me, where is the station in this area?"
نعم عندنا حجز ليك.,Na3m 3ndna 7jez lik.,,"Yes, we have a reservation for you."
سمحلي، ولكنبغيت نمشي للفندق ديالي في المدينة بالطوبيس. فين ممكن ناخد الطوبيس؟,"Sme7li, walakin bghit nmshi lfondoq dyali f lmdina b tobis. Fin momkin nakhod tobis?",,"Excuse me, but I want to go to my hotel in the city by bus. Where can I take the bus?"
الدجاج، عافاك.,"ddjaj, 3afak.",,"Chicken, please."
هادي هي الغرفة جوج صفر واحد. بغيت نطلب الفطور غدا.,hadi hiya lghorfa 2 0 1. bghit ntlb lftour ghda.,,This is room 201. I would like to order breakfast tomorrow.
شنو رأيك في التحرش الجنسي في بلاصت العمل؟,shno ra2yak f tta7arosh ljinsi f blaset l3amal?,,What do you think about sexual harassment in the workplace?
عندي جوج خواتات.,3ndi juj khwatat.,,I have two sisters.
الرحلة رقم اثنين صفر ثمانية، إلى طوكيو.,"lre7la rqam 2 0 8, ila Tokyo.",,"Flight number 208, to Tokyo."
ومن بعد خليونا نحشيوها من لداخل.,w mn b3d khliyona n7shiwha mn l dakhel.,,"And then, let’s stuff it from the inside."
خليونا مجموعين نناقشو هاد الموضوع كثر.,khliwna majm3in nnaqsho had lmo9o3 ktr.,,Let's stay together and discuss this topic more.
كيفاش بغيتي نصوبليك شعرك اليوم؟,Kifash bghiti nsawb lik cha3rak lyoum?,,How do you want me to style your hair today?
ممكن تقول هادشي بكلام آخور؟,momkin tgol hadchi bklam akhor?,,Can you say this differently?
غادي نديره مهما كان عندك.,Ghadi ndiro mahma kan 3ndk.,,I will do it no matter what you have.
بغينا طبلة قريبة للمسرح.,bghina tabla qriba lmasra7.,,We want a table close to the stage.
أنا مزيان اذن نتا غاتمشي لشي بلاصة؟,"Ana mzyan, idan nta ghatmshi lshi blasa?",,"I'm good, so are you going somewhere?"
هادي ألفين وأربعمائة متر ديال العلو.,hadi 2000 w 400 miter dial l3lou.,,"This is 2,400 meters of altitude."
دخل عافاك حط هادي فوق الطبلة هناك.,dkhl 3afak 7e6 hadi fo9 6abla hnak.,,"Come in, please put this on the table over there."
عافاك لغي رقم البطاقة ديالي.,3afak lghi ra9m l-bta9a dyali.,,Please delete my card number.
أنا آسف، انهم جميعا بيعت، ولكن سيكون لدينا لهم في غضون أيام قليلة.,"Ana asf, ennhom jmi3an biy3t, walakin ghadi ykono 3ndna fihom f ghodoun ayam 9lila.",,"I'm sorry, they are all sold out, but we will have them in a few days."
ممكن ناخد شوية ديال القهوة؟,momkin nakhod chwiya dial l9ahwa?,,Can I have some coffee?
ماعنديش موعد ولكن الامر مستعجل.,ma3andiš maw3id walakin l2amr msta3jel.,,"I don't have an appointment, but it's urgent."
هادا ممصوبش مزيان.,haada mamsoobsh mzyan.,,This is not well-made.
فين السلالم المتحركة؟,Fin s-salalm l-mt7rka?,,Where are the escalators?
واش عندك كتيب للأحداث؟,wash 3ndk kteb l2a7dath?,,Do you have a booklet for events?
فين هو مدخل مترو الانفاق؟,Fin howa madkhal metro l-anfa9?,,Where is the subway entrance?
ضيعت تذكرة ديال الطيران.,Dya3t tdkira dial ltiyaran.,,I lost the plane ticket.
تقدر تجلس هنا فالعطلة؟,T9dar tjles hna f l3tla?,,Can you stay here during the vacation?
أوه، أنا آسف بزاف الى كنت زعجتك.,"Oh, ana asf bzzaf ila knt z3jtk.",,"Oh, I'm very sorry if I bothered you."
ممكن ليك تحجز الأحداث؟,Mumkin lik t7jz l2a7dath?,,Can you book the events?
واش كاين حمام عام قريب من هنا؟,wash kayn 7mam 3am qrib mn hna?,,Is there a public bathhouse near here?
شحال المجموع؟,Ch7al lmajmou3?,,How much is the total?
هادشي مزيان بزاف. الآن الأسئلة، عافاك.,"hadchi mzyan bzaf. daba l2as2ila, 3afak.",,"This is very good. Now the questions, please."
عندك شي صرف لعداد الموقف؟,3ndk shi srf l3dad lmwqf?,,Do you have any change for the parking meter?
أكثر حاجة تباعت في الاربع سنوات اللي فاتت هي جهاز تصوير ايه ايكس أربمائة وخمسين.,Akthar 7aja tba3at fi l-arba3 snin lli fatet hiya jihez taswir AX450.,,The best-selling item in the past four years was the AX450 imaging device.
واش ننتقل لليسار؟,wash nntql llysar?,,Should I move to the left?
واش كاين شي مضيفات كيهدرو اللغة اليابانية؟,wash kayn shi modifat kihdro llogha l-yabaniya?,,Are there any flight attendants who speak Japanese?
ثمن مزيان، ياك؟,"Thaman mzyan, yak?",,"The price is good, right?"
خاصك تاخدو تسع وتسعين مرة فالنهار، قبل الماكلة.,"Khasek takhdo 99 marra f nhar, qbel lmakla.",,"You need to take it ninety-nine times a day, before eating."
انا كنبغيه.,ana kanbghi7.,,I love him.
بغيت حمالة ثلاثية.,bghit 7mala tlatiya.,,I want a triple carrier.
بغيت لبسة ديال الرياضة.,bghit lbsa dial riyada.,,I want sportswear.
يمكن ليك تجلس فداري.,Yemken lik tjles f dari.,,You can stay at my house.
ممكن نتكى على المقعد ديالي، عافاك؟,"momkin ntka 3la l-ma9ed dyali, 3afak?",,"Can I recline my seat, please?"
عظيم. كنت كنبحث على طاكسي، ولكن هادا أحسن.,"3zim. Knt kanb7ath 3la taxi, walakin hada a7san.",,"Great. I was looking for a taxi, but this is better."
معطف مزيان واش صنع بريطاني؟,m3taf mzyan wash sna3 bri6ani?,,"A nice coat, is it British-made?"
باغي نمشي لمركز هارفارد. ممكن تعلمني ملي نوصلو لتما؟,Baghi nmshi lmarkaz Harvard. Momkin t3lmni mlli nwslou ltma?,,I want to go to the Harvard Center. Can you guide me when we get there?
جوج بالغين وطفلين، عافاك.,Erreur,,Erreur
شحال الثمن؟,Ch7al tman?,,How much?
حرب النجوم كان أكبر نجاح فالف تسعمائة واربعة وثمانين.,7arb nnojom kan akbar nja7 f 1984.,,Star Wars was the biggest success in 1984.
فين قسم غير المدخنين؟,Fin qism ghir l-mdkhnin?,,Where is the non-smoking section?
"""هادا هو """"ت"""" بحال فتوم، نعم عندي هنا، أتارو.""","haada howa ""t"" b7al ftoom, na3m 3ndi hna, ataro.",,"""This is 'T' like in Tom, yes I have it here, its trace."""
كنظن بلي هادا المناظر الطبيعية الخلابة.,Kanghonn blli hada lmanader ttabi3iya lkhlaba.,,I think these are breathtaking natural landscapes.
بغيت شوية ديال التفاح، عافاك.,"bghit chwiya dial ttfah, 3afak.",,"I want some apples, please."
لأي حاجة كيصلاح؟,L2ay 7aja kaysla7?,,What is it useful for?
شنو نوع البطاقة ديال الائتمان اللي كتقبلها؟,Chno no3 l-btaqa dyal l-i'timan lli katqblha?,,What type of credit card do you accept?
عندي بزاف ديال الوقت.,3ndi bzaf dial lwa9t.,,I have a lot of time.
واخا دابا وقت الغدا ممكن نناقشوه وحنا كنتغداو؟,wa5a daba wqt lghda momken nnaqshoh w7na kantghdaw?,,"Okay, since it's lunchtime now, can we discuss it while we eat?"
تسرقلي المسجل ديال الفيديو من الغرفة ديالي.,tsrqli lmosajel dial lvideo mn lghorfa diali.,,You stole the video recorder from my room.
مرحبا، اسمي أودا. عندي حجز لهاد الليلة، ولكن غادي نكون متأخرة شوية للتدقيق. اذنا، عافك احتفظ بالحجز ديالي.,"Mar7ba, smiti Ouda. 3ndi 7jaz lhadi lila, walakin ghadi nkoun mta2khra chwiya lttadqiq. Idan, 3afak 7tafeD b l7jaz dyali.",,"Hello, my name is Ouda. I have a reservation for tonight, but I will be a bit late for check-in. So, please keep my reservation."
هاد الصباط قوي؟,had sbat 9wi?,,Are these shoes durable?
عافاك قول ليه بلي كنتظر المكالمة ديالو.,3afak goul lih blli kant9eder l'mokalma dialo.,,Please tell him that I’m waiting for his call.
كيقولو بلي الانفلونزا منتشرة هنا.,Kayqolo blli l'anflwanza montachra hna.,,They say that the flu is spreading here.
فالداخل.,f dakhil.,,Inside.
أنا آسف. عامرين لليلة ديال غدا.,Ana asf. 3amrin l-lila dial ghda.,,I'm sorry. We're fully booked for tomorrow night.
انا مع شي اصحاب.,ana m3a chi s7ab.,,I am with some friends.
وفقا لغورو، السيد يامادا عندو جوج أطفال.,Erreur,,Erreur
ممكن تقول هادشي مرة اخرة؟,momkin tgol hadchi mara okhra?,,Can you say that again?
باغي ندور لبرج لندن.,Baghi ndour lborj London.,,I want to visit the Tower of London.
عافاك ربط حزام الأمان ديالك.,3afak rbat 7zam l2aman dialk.,,Please fasten your seatbelt.
رمز المنطقة هو ثلاثة. رقم الهاتف هو اثنين ثلاثة أربعة ثلاثة أربعة صفر صفر.,rmz lmanTiqa howa 3. raqm lhatif howa 2 3 4 3 4 0 0.,,The area code is three. The phone number is two three four three four zero zero.
سمحلي. واش كاين شي جسر قريب من هنا؟,Sme7li. Wash kayn shi jser qrib mn hna?,,Sorry. Is there a bridge near here?
سمحلي، بغيت نستخدام المرحاض.,"Sma7li, bghit nst3ml lmr7a9.",,"Sorry, I need to use the restroom."
راها عامرة.,raha 3amra.,,It's full.
حوايجو ديما تابعة الموضة.,7wayjo dima tab3a lmo9a.,,His clothes are always fashionable.
واش عندك ماكلة ديال البحر؟,wash 3ndk makla dyal lba7r?,,Do you have seafood?
غالية بزاف.,ghaliya bzzaf.,,Very expensive.
باغي، ولكن متأسف مقادرش نديره هاد الوقت.,"Baghi, walakin mta2sef ma9adrsh ndiro had lwa9t.",,"I want to, but sorry, I can't do it right now."
واخا، أنا مزال ماعارفش دابا، ولكن غنحاول بالتأكيد.,"Wakha, ana mazal ma3arfch daba, walakin ghan7awel bta2kid.",,"Alright, I still don't know for now, but I will definitely try."
الملحة عافاك.,lmel7a 3afak.,,"The salt, please."
عافاك استخدم الغرفة ديال التقياس هناك.,3afak est5dem l'ghorfa dial t9yas hnak.,,Please use the fitting room over there.
تسعين دولار تذكرة اتجاه واحد . فلوس أو بطاقة؟,ts3in dollar tdkra itijah wa7d. flous aw bita9a?,,Ninety dollars for a one-way ticket. Cash or card?
ممكن تمسحلي الطولة، عافاك؟,"momkin tmsa7li l-ṭawla, 3afak?",,"Can you clean the table for me, please?"
كيفاش كيربي الآباء اليابانيون أطفالهم؟ واش صارمين مع أطفالهم؟,Kifash kayrabbio l-abaa' l-yabaniyyin atfalhom? Wash sarmin m3a atfalhom?,,How do Japanese parents raise their children? Are they strict with them?
ممكن تقولي ساعات العمل؟,Mumkin t9olli sa3at l3amal?,,Can you tell me the working hours?
عافاك جمعهوم مفرقين.,3afak jme3hom mfriqin.,,Please gather them separately.
كنحس بالمعدة ديالي ثقيلة.,Kanhess b lma3da dyali t9ila.,,I feel like my stomach is heavy.
هادشي كيبان مزيان فين ممكن نتسناوكوم؟,"Hadchi kayban mzyan, fin momkin ntsnawkome?",,"This looks good, where can we expect you?"
ممكن نبداو اللعب ملي يساليو؟,mokn nbdao l3b mlli ysalio?,,Can we start playing when they finish?
عدد سكان اليابان تقريبا مائة وعشرين مليون نسمة.,3adad sokkan l-yaban tqreeban miya w 3shrin milyoun nsma.,,The population of Japan is approximately one hundred and twenty million.
عمر هاد حاجات على بطاقة التسجيل.,3omr had 7ajat 3la bita9at at-tasjil.,,Omar filled out these things on the registration card.
ممكن ناخد حوايجي مرة اخرى؟,momkin nakhod 7wayji mara okhra?,,Can I take my stuff again?
واش عندك شال ديال الحرير بغيت هدية للزوجة ديالي.,wash 3ndk chal dial l7rir bghit hdya llzwa9a diali.,,Do you have a silk scarf? I want a gift for my wife.
غادي نجيبوهلك دابا. شنو رقم غرفتك؟,Ghadi njibohlek daba. Shno raqm ghrftek?,,We’ll bring it to you now. What’s your room number?
السيد كوباياشي كان كيبحث عليك.,s-sid Kobayashi kan kayb7ath 3lik.,,Mr. Kobayashi was looking for you.
باغي نسافر من شنغهاي إلى هاواي بالسفينة.,Baghi nsafar mn Shanghai l Hawaii bssfina.,,I want to travel from Shanghai to Hawaii by ship.
ممكن تصيفط شي حد؟,momkin tsifT shi 7ad?,,Can you send someone?
واش ممكن يكون واجد فالساعة الخامسة ديال الليل غدا؟,Wash momkin ykoun wajd f sa3a l5amsa dial lil ghdda?,,Could he be ready at 5 a.m. tomorrow?
كيستغرق عشر دقائق على الرجلين.,kaystaghraq 3shr d9aye9 3la rjlin.,,It takes ten minutes on foot.
قبل ما نكملو، عطيني شي دقائق؟,"qbl ma nkamlo, 3tini chi da9aye9?",,"Before we continue, can you give me a few minutes?"
فين ممكن نوقف السيارة ديالي؟,Fin momkin nwa9ef s-sayara dyali?,,Where can I park my car?
كنحس بالبرد و المعدة ديالي كتألمني بزاف.,Kanhess b lberd w lma3da dyali kat2almeni bzaf.,,"I feel cold, and my stomach hurts a lot."
سكوتش وماء، عافاك. وعندك شي ماكلة خفيفة؟,"Skotch w ma2, 3afak. W 3ndk chi makla khfifa?",,"Scotch and water, please. Do you have any light snacks?"
كيفاش نطفي هاد الضو؟,Kifash nTfi had ddo?,,How do I turn off this light?
واش هو مشغول بزاف اليوم؟,wash howa mshghoul bzaf lyoom?,,Is he very busy today?
بغيت شي خيط.,bghit chi khit.,,I want some thread.
عطني شهادة طبية، عافاك.,"3aṭni chahada ṭibiyya, 3afak.",,"Give me a medical certificate, please."
بغيتك تنقصلي إنش واحد من هنا.,bghitk tnqesli inch wa7ed mn hna.,,I want you to remove one inch from here.
ما حاسش براسي مزيان عافاك عطيني شوية ديال الدوا.,ma 7assch brasi mzyan 3afak 3tini chwya dial ddwa.,,"I don't feel well, please give me some medicine."
